地区,店舗名,リンク,最寄り駅,距離,予算,席数,個室,キーワード,コメント数,コメント
新宿,新宿御苑 ろまん亭,https://www.hotpepper.jp/strJ000980637/,新宿御苑前駅,5,2000,21,なし,特別な日も、何もない日も。,0,
新宿,新宿 ボカ BOCA SPANISH BAR  スペインバル  ,https://www.hotpepper.jp/strJ000711579/,JR新宿駅,1,6000,55,なし,新宿西口出口徒歩1分 地下隠れ家スペイン,8,"コース6品 前菜星=2つサラダ=星2つマッシュルームと海老のオリーブ炒め=星4つイベリコ豚=星4つパエリア=星4つ 美味しかったー 初めてパエリアを食べたけど想像以上に美味しかったです。接客もすごく丁寧でよかったです。また行きたいと思いました。 是非行ってください。 新宿駅から近く、店はあまり広くありませんが、隠れ家的なお店です。イケメン店員さんもいて、パエリア・生ハム、料理もすごく美味しいです。デートや仲間うちでワイワイできる、そんなお店です。クーポンの割…つづきを読む バルで一杯 カジュアルな雰囲気のお店です。コースにしたら、まずは前菜盛り合わせが出てきた。店頭に飾ってあるのを切り落としたと思われる生ハムが美味しい。それにふわふわのオムレツ、サラダとキノコのガーリックソテ…つづきを読む おいしーぃ、パエリア♪ まだ2回しか訪れた事がないのですが新宿駅からも近く、また、入り口がこじんまりしていて、お店の雰囲気もステキです。そして、なんといっても料理。パエリアが食べたくなり、いろいろと探しました。お…つづきを読む 気軽に入れる隠れ家Barヾ(´ω｀＝´ω｀)ノ 特に決めないで歩いていたところ見つけたこちらのお店で乾杯(*´д｀*)""隠れ家""というとどことなく閉鎖的なイメージがありますが(^ω^;)(;^ω^)、こちらの店は心配無用！いざ入ってみる…つづきを読む 気軽に入れる大人の隠れ家！ 「大人の隠れ家」という言葉がお店情報に使われていますが、賑やかさや明るさのある、とっても入り易い隠れ家です。メニューはお店に人気メニューと書かれていたアンチョビキャベツが人気どおり美味！他…つづきを読む 大人にオススメなスパニッシュ・バル ガブのみ スパニッシュ・バル　ＢＯＣＡ！今月にオープンしたという『ＢＯＣＡ』オープンキッチンでカウンター席も充実。テーブル席とスタンディング席合わせて１０席以上もあり、大人数でもカップルで…つづきを読む"
新宿,肉バル Ko nan 新宿東口店（コナン）,https://www.hotpepper.jp/strJ001100316/,★JR新宿駅,1,3000,250,あり,新宿肉バル×個室×1000円OFF,0,
新宿,個室ダイニング カスケード新宿本店,https://www.hotpepper.jp/strJ000746645/,［新宿駅,5,5000,88,あり,◆カラオケパセラ・フーズフーズの系列店◆,15,友達の誕生日サプライズに！ 数量限定の女子会コースでお願いしたのですが、ハニトーにメッセージと花火がついていたり、BGMと照明で演出して下さったり、主役がとても喜んでくれました。店員さんもとてもフレンドリーで楽しい3時間でした…つづきを読む 友達の婚約祝いで利用 7人で予約しましたが、当日急遽二人増え変更の連絡をしました。店長さん、女性スタッフさんの対応がとても感じが良くこちらの都合なのに快く受けてくださいました他のスタッフやサービスも良く次回の予約をしてし…つづきを読む 先日友人の結婚祝いと誕生日祝いで利用しました。 予約の時点でサプライズでお祝いしたいことを伝えたら、前日予約であったにも関わらず親切に対応して下さいました。パセラ系列のお店は数回利用したことがありますがカラオケのイメージとは違ってオシャレで雰囲気…つづきを読む えっ!?こんなに豪華な生ハムが・・・ 2016年2月に友人とふらっといきました。入り口はちょーっと敷居が高い雰囲気がありますが店員さんがかなりフレンドリーで緊張がほぐれました!!飲み放題コースを頼みましたがスタンダードなドリ…つづきを読む 2015年12月頃夕食の時間帯に行きました 合コンの場所として選択しました。料理も美味しく、雰囲気も良かったです。また、マジシャンの方が盛り上げてくださり、とても楽しい時間を過ごせました！ 気持ちの良い店 いつも利用させて頂いております。細かい所までサービスが行き届いていると思います。店員さん達の接客も素晴らしいと思います。料理も美味しいし、安いし、バリ風で雰囲気も良い。少人数～大人数ま…つづきを読む 素晴らしい接客 彼女の誕生日で利用させていただきました。数日前に誕生日で利用させていただきたいという旨で電話をしました。誕生日用のハニトーと席を予約させていただき、その後、お店の方から他にもお手伝いできることはあ…つづきを読む 会社の同僚と一緒に。。。 仕事帰りに同僚の女性2名に誘われて行きました♪系列店のパセラには何回か行った事がありますが・・・このお店に入ったのは初めて！！階段を降りると・・・滝が流れていて、昔バリ旅行に行った際に訪れた…つづきを読む 気配りが行き届いていました。 久々の友人と再会するため、女子会コースを利用しました。とにかく、心配りが素晴らしかったです。サプライズ的なサービスもありましたし、お手洗いもアメニティが充実していました。また利用したいと思え…つづきを読む 内装はゴージャスな感じ 内装はゴージャスな感じで、店員さんの接客も丁寧で良かったです。エスニックテイストの料理は可愛らしい盛り付けで、特に女性人気が高いお店です。 大人数の女子会はカスケードでワイワイ 金曜日の夜に８時から７人女子会で利用しました。場所が歌舞伎町という事もあり、不安もありましたが、、ミスドをめざすと直ぐに分かりました。そんなに怪しい場所になくて安心！笑パセラ系を利用するのは初…つづきを読む デートで☆ 二人でコース&飲み放題で約10000.お料理大満足しました(*^^*)個室、とありますが正式にはカーテンでしきったソファ席にかんじましたが、新宿でこんなゆったりした席に座れるのは素敵だと思いました！…つづきを読む 最高の誕生日になりました。 私が行ったのはつい最近でした。飛び込みだったのに席空けてくれてよかったです♪リゾート感満点で雰囲気がとてもよかったです！しかも接客態度がはんぱなくよくてびっくりしました。サプライ…つづきを読む 女子会に最適！ 女友達7人で利用させていただきました！年末ということで予約が多かったのか2時間制でしたが、VIPなソファー個室に案内していただけたのでゆったり過ごせました。料理は多少味付けが濃い気がしましたが、サ…つづきを読む 二人だけの空間を創出 女の子の親友と行きました。店は新宿区役所のすぐ近くです。この店が入ってるビルは全部この店の系列らしく、二次会もここで出来そうな感じでした。今回は個室を使いました。ここの店の個室はＬ字ソファーでク…つづきを読む
新宿,クラフトビールタップ 新宿三丁目,https://www.hotpepper.jp/strJ001119482/,JR新宿駅,5,3500,79,なし,世界のクラフトビール専門店,1,ビール好きにはたまらないお店 二人では久々の新宿だったので、迷ったけどビール好きな旦那が好きそうなこちらを予約。大塚家具の近くなので、すぐに見つけられました。広い店内で照明おとしめでゆったりできそうな雰囲気。感じのいいスタ…つづきを読む
新宿,個室×チーズタッカルビ 空庭 -そらにわ Sky Garden- 新宿店,https://www.hotpepper.jp/strJ001018171/,JR新宿駅,1,2000,100,あり,話題のとろ～りチーズタッカルビSTART♪,6,コスパ最高 チーズフォンデュとチョコフォンデュ食べ放題で、かつバーニャカウダも食べられる♪チーズフォンデュは多少チーズが薄いけど、お腹いっぱい食べられるし、そこまで混んでなければ3時間なので素晴らしい。それで…つづきを読む ぎゅっと詰まったいいお店 この間、友人5人で利用しました！店全体的にこじんまりとしていて、席で好きなことの距離が近くてドキドキしました。でも店内はとても照明がまぶしくて、暗くなかったからすごく安心できました。椅子には座る…つづきを読む 女子会 会社の女子会で利用させていただきました。2480円の女子会7品コースでしたが、料理はおいしかったです。飲み放題も+500円のプランではありましたが、カクテルが豊富で濃さもちょうどよかったです。お店…つづきを読む 飲み放題でアルコールの種類も豊富 オシャレな個室を使うことが出来、飲み放題でアルコールの種類も豊富でした。女子会や宴会に使っている人も多く、スタッフもテキパキと動いており親切でした。 おしゃれな雰囲気です 非常におしゃれな雰囲気で落ち着いて飲むことができます。二次会やデートにもいいと思います。お料理もメニューが豊富で飽きないですね。 おしゃれな雰囲気で美味しい鍋が食べられるお店♪ この前使ったときに思った率直な感想です☆(≧∀≦*)タコス鍋ってどうなのぉ？って思ったんですけど、実際食べたらクセになりそうでしたー♪もちろん他の料理もすごく美味しかったし、女子会コースだからか…つづきを読む
新宿,スーパードライ 新宿店,https://www.hotpepper.jp/strJ000011195/,ＪＲ新宿駅,1,3800,144,なし,【新宿】古き良き活気溢れる本格ビアホール,7,色んな国なビール！ 色んな国のビールも飲めて、ビール好きにはオススメです。おつまみも種類がけっこうあります。ソーセージの盛り合わせやジャーマンポテトを食べてる方が多いかな。お店の名前にもなってる通りスーパードライ…つづきを読む ソーセージうま～ 忘年会で同僚と5人で伺いました。お店はちょっと高級感がありますが、出てくる料理、ドリンクともにとても満足できます。ドリンクはやはりアサヒスーパードライ！店員さんも丁寧な接客で、とても気持ちよく時…つづきを読む ビールがすすむ 新宿駅からすぐの場所にお店があります。アサヒビールのアサヒスーパードライを店名にしたお店です。店内はおしゃれでいい雰囲気があります。生ビールはメーカー直営店の安定感があり、美味しく注いでいる印象…つづきを読む 暑い夏 あつーい夏に美味しいビールが飲みたい！特に大好きなアサヒビール。本当に美味しいビールが味わえるお店だと思います。キンキンに冷えたビールののど越しは最高で、缶ビールでは絶対に味わえない・他店でも味わえな…つづきを読む 昼からビール 知人と新宿散策中、休憩しに入った店。店は広く、テーブル席多め。昼過ぎからビール好きが募っていて1個1個カルトでは少し値が張りますがビールの入れ方は安定してる気がします。 これぞスーパードライ 旨いビールが飲みたくてビール好きな友人といってきました。注ぎたてのスーパードライは暑い日に今日みたいな最高！料理も魚系のものとソーセージなどのドイツ系があり、どれも旨かったです。友人は黒ビール…つづきを読む 喉にカーーーーーーーっとくるスーパードライは最高でしょ★ ここに来るまでは、正直ビールの味の違いがわからなかったので好きなラベルのビールをいろいろ変えて飲んでました。ビールが大好きな友人が「スーパードライの味を知らないなんて！」とここに連れてこられた…つづきを読む
新宿,美々卯 新宿店,https://www.hotpepper.jp/strJ000243038/,JR新宿駅,2,7000,144,なし,創業200年の老舗,7,優雅なランチ 友人と二人で新宿で落ち着いた店でゆっくりランチできる店を探していて見つけました。ゆったりした雰囲気で、店内も広くて、年齢層高めで、優雅にランチを楽しめました。関西風のお出汁で、お値段もそれほど高くなく…つづきを読む 美味しくて安いです。 手頃なのに、美味しい和食料理屋さんが、新宿に？！高級店と変わらぬ美味しさですが、安いです！2000円あれば、美味しい定食が食べれます。美味しいですよ～！すきやき、冬には牡蠣うどん。とにかく美…つづきを読む 美味しいです！ 本格的な、和食料理が味わえます。とても美味しい＼(^o^)／そこらへんの和食レストランよりも美味しい。少し高級感が味わえます！すき焼きなどもあります。定食もある。冬の牡蠣うどんのだしが…つづきを読む うどんすき うどんすきというお料理を初めて知ったのがこの美々卯です。とても落ち着いた店内で接待などにも重宝しそうなお店。もちろんサービスも行き届いています。ランチはお昼のうどんすきが2500円。三種盛合わ…つづきを読む うどんすき 大好きなうどんすきを食べに行きました。えびの調理方法を聞いてくれます。生きたままだと新鮮すぎて飛び跳ねるので注意です。ゆっくり食べることができます。お鍋も、はじめは店員さんが作ってくれるので安心です。 ダシが決め手！！ 寒い日だったので暖かいものが頂きたくなってこちらへみみうといえば　うどんすき♪出汁が良く出ていてホントウに美味しいです☆その他の和のメニューも充実のラインナップお造りの出し方もすごく綺…つづきを読む 落ち着いて鍋料理が楽しめるお店 大阪に本店がある、和食のお店です。うどんすきとしゃぶしゃぶを食べたことありますが、どちらも美味しく落ち着いた雰囲気で料理を楽しめます。うどんすきは肉、海の幸、野菜とバランス良く入っており、…つづきを読む
新宿,個室居酒屋 越後屋 久保田 新宿店,https://www.hotpepper.jp/strJ000972671/,ＪＲ新宿駅,3,2999,130,あり,新潟の郷土料理・銘酒を新宿で堪能,0,
新宿,本格中華×食べ放題居酒屋 中華物語 新宿東口店,https://www.hotpepper.jp/strJ001040385/,,1,3980,50,あり,新宿 東口駅前 中華 食べ放題Dining,3,美味しい中華が食べ放題!! 思いっきり中華が食べたくて、予約しました♪友人と８人くらいで入店したのですが、１０名以上座れる広めの席に通してもらいゆっくりと食事を楽しむ事ができました＞＜最初に何品か出してもらえますが、どれも…つづきを読む 落ち着いた雰囲気 平日の夜に会社の元同僚＋αの3人で利用しました。店内は男女半々という感じで、仕事終わりのリーマンやOLが多い雰囲気でした。もやしニラ炒めのもやしがシャキシャキしていて美味しかったです。今回はお…つづきを読む 美味しかったです 値段もリーズナブルなので色々食べましたがどれもとても美味しくて最高でした。落ち着いた雰囲気のお店でとてもよかったです。
新宿,生ハム 食べ放題 ダイニングダーツバー Ｂｅｅ 新宿店,https://www.hotpepper.jp/strJ000011656/,JR新宿駅,1,3000,180,あり,新宿/忘年会/懇親会/サッカー/観戦/誕生日,9,"サプライズ 友達と記念日コースで来店しました。店内はアミューズメントパークのように色々な仕掛けや部屋がありワクワクしましたお料理もどれも見た目も可愛いし美味しくて大満足～♪最後に写真ケーキで頼んでいた…つづきを読む とても満足です！ 会社の忘年会のダーツ大会に使わせていただきました。無理をいったにもかかわらず、とても丁寧に対応してくださり、参加者をかなり盛り上げてくれました。料理もお酒も美味しかったです。皆とても満足していま…つづきを読む 楽しく飲んだ後は""すべらない""ダーツで気分転換っ(｀・ω・´) 合コン後の2次会に行きました(・∀・)有名なあの""すべらない話""のセットをイメージさせるような(゜ωωω゜)、金持ちセレブのPlayroomに来たような感じ(よ、酔っ払いすぎ( ´;゜;ё;゜;)…つづきを読む 異空間でダーツナイト 新宿駅近くのビルの地下に異空間が広がり、2フロアにダーツバーやカップル個室、カウンターなどがある。大音量の音楽に包まれて、酒を飲みながらのダーツで少しの時間を過ごす。ダーツの調子が良け…つづきを読む デートや合コンの二次会に最適！ 新宿東口からすぐ近く、お店の中が意外に広いので、ゆったり楽しめます。お酒も種類がたくさんあるので、女性も楽しめると思います。ダーツなどもあり、23時からはバーテンダーのショーみたいなものもやっ…つづきを読む しばらく笑顔が消えなかったので感謝ですね。 日曜日お昼ご飯１軒目に「Ｂｅｅ　ＳＨＩＮＪＵＫＵ」さんに行きました。いわずと知れたダーツバーですが、土日祝はランチから営業をされていまして、いただきましたのは人気の「Ｂｅｅ新宿店特製じっくり煮…つづきを読む 時間を忘れちゃう コースに含まれてたロシアンシューで盛り上がったりました!!ダーツはもちろん、店にあるLOVEジェンガや黒ひげ危機一髪みたいのとか、、、いろんな遊びグッズがあって本当に楽しめます♪♪８人で行…つづきを読む とっても楽しめるお店です！ 一昨日、飲み会のあと終電が無かったので、友達4人とダーツをしてオールナイトしました。お店のインテリアはとても工夫がされていました。また、料理もちょっと変わったメニューがあって楽しめました。例えば、1個…つづきを読む 楽しい雰囲気が欲しいなら♪ はじめて、Barって言う名前のつくところにいきました。しかも、最近仲良くなった男の子と行ったために、ドキドキでした。でも、お店の雰囲気が良かったため、すぐに打ち解けることが出来ました。店のいろんなとこ…つづきを読む"
新宿,全席個室ダイニング NAMAHAGEYA～なまはげ屋～ 新宿西口店,https://www.hotpepper.jp/strJ001099038/,JR新宿駅,-1,3500,190,あり,秋田 郷土料理 飲み会 宴会 新宿西口 3時間,2,立地と安さ 秋田料理店であるにもかかわらず、秋田の地酒を置いていないなど、首をかしげたくなるところもあるのだけれど、駅から大変近く、個室で、かつやすいお店で、その意味で便利なお店だと思いました。 鍋好きにおススメ♪ 選べる鶏鍋2ｈ食べ放題のコースを利用しました。鍋はスープとしめが選べ、辛いもの好きな私たちは赤から鍋としめはご飯でいただきました。鍋以外にもサラダや揚げ物も出てきてかなり満足です！是非また利…つづきを読む
新宿,完全個室居酒屋 星夜の宴 新宿東南口店,https://www.hotpepper.jp/strJ001018608/,新宿駅,1,3000,70,あり,完全個室居酒屋 新宿駅東南口&東口徒歩1分,3,話しを聞く場所にはなります 入口がわかりにくく、ひと回り廻って、やっと入りました。メニューはそれほど豊富ではありませんが、ゆっくり相手と向かい合える空間は得られますので、食事をしつつ相談に乗るなんて時はいいかもしれません。…つづきを読む 恋人と2人きり 初めて利用しました。席は扉がしまるので、話し声は聞こえますが周囲の視線はシャットアウトでき、とても良かったです。それと、壁に特殊塗料でペイントされた星座は綺麗でした！椅子とテーブル以外のスペースは…つづきを読む 2015年12月頃ランチの時間帯に行きました 早めのクリスマスで妻と二人で利用しました。二人の星座とは無関係のさそり座の個室だったけれど記念になりました。用意して渡したクリスマスプレゼントのハートのピアスも喜んでその場でつけてくれました。オ…つづきを読む
新宿,新宿鍋酒場 一和 -ichiwa- 東口店,https://www.hotpepper.jp/strJ001027217/,新宿駅,5,2000,100,なし,新宿鍋食べ放題＆３H飲み放題付2480円♪,0,
新宿,デザイナーズ個室 × チーズタッカルビ MIU 新宿店,https://www.hotpepper.jp/strJ001009323/,新宿駅,1,3000,90,あり,☆新宿で話題のリゾート×チーズバル☆,5,とても綺麗でした お店の雰囲気がとても綺麗で良かったですね。料理もどれも美味しくて最高でした。これはまた行きたいですね。 幻想的な雰囲気が良いです 大きな水槽があり、幻想的な雰囲気が良いです。メニューは居酒屋の定番のものが揃っており、焼き鳥などはジューシーで美味しかったです。 ☆パンケーキ☆ 先日、高校時代の友達と久しぶりに集まった際に友達が予約してくれて行きましたー（＾∀＾）♪お店の雰囲気がほんっとに良くて、おっっきな水槽に感動しました!!!笑女子会のコースを利用したんですけど…つづきを読む 新宿女子会 GW久しぶりに会う友人と、こちらのお店を予約していってきました。割りと早い時間の利用だったのか、店内も空いておりゆったりできました。店内はアクアリウムがあり幻想的なお店で、雰囲気はとてもよかっ…つづきを読む 歓送迎会でつかわさせていただきました。 歓送迎会でこちらの店舗に行ってみました。コースがお安く、内容＆店の雰囲気もオシャレそうだったので。。。実際行ってみると、まず、料理が美味しい、雰囲気も○！対応もスムーズで良かったです。レタ…つづきを読む
新宿,宴会 和食 居酒屋 「和民」 新宿東口靖国通り店,https://www.hotpepper.jp/strJ000124001/,☆新宿で居酒屋をお探しでしたらぜひ当店へ♪【新宿駅,1,2600,120,あり,新宿 居酒屋 飲み放題 3時間 宴会 団体,3,美味しかったです！ 土曜の飲み放題、やたら高かったり、コメント欄から見ると怪しそうだったり。久しぶりの友人との再会、お店選びで嫌な思いはしたくないなぁ、とチェーン店を選択！飲み物が出てくる時間のムラはちょっぴりありま…つづきを読む 安くて安定感がある。 安くてよかった。満足です。店員の対応も良いので、安定感がある。特に料理や雰囲気に拘る必要がない時におすすめです。客層は若い人が多いと思う。 抜群に美味しい 店員の協調性があって、とても魅力的な時間を過ごせました。料理が抜群に美味しいのでリフレッシュする事ができます。
新宿,HangOut HangOver 西武新宿 Brick St.店,https://www.hotpepper.jp/strJ001144693/,西武新宿駅,1,3500,81,なし,新宿/誕生日/女子会/ランチ/貸切/カフェ/肉,1,オールデイ・アメリカンダイナーの看板に相応しいお店です。 西武新宿駅徒歩0分の好立地にオープンしたこのお店。内装からメニュー、音楽に至るまで、こだわり抜いたアメリカンテイストな雰囲気が◎です。充実したメニューは、お店のコンセプトが米国NYのストリートファ…つづきを読む
