地区,店舗名,リンク,最寄り駅,距離,予算,席数,個室,キーワード,コメント数,コメント
池袋,氷温熟成鶏と釜飯 居酒屋 かまどか 池袋メトロポリタン口店,https://www.hotpepper.jp/strJ000767211/,各線池袋駅,1,2980,102,あり,居酒屋 もつ鍋 個室 宴会 焼き鳥,8,良かった 居心地が良かったです。店員も対応が良かったです。また来たいです、、、、、、、、、、、、 ゆっくり雰囲気を楽しむのにいいお店 ご飯を食べるでもゆっくりお酒を飲みに行くでも良いお店です。店名通り釜飯が豊富なので、ご飯食べたい！って思って行ってもいいですね。居酒屋にはめずらしく蕎麦がありますが、するすると食べれてしまう品です…つづきを読む 2015年04月頃夕食の時間帯に行きました おつまみが美味しいので大満足です。特にかまどかの売りの熟成鶏は臭みのない旨味のある鶏肉を美味しく調理してます よかったです 店内の雰囲気がよく、みんなでゆっくり話ながら楽しむことができました。料理もリーズナブルで美味しかったので満足です。 鶏料理！ 友達と５人で利用しました。お店は混んでましたが、ドリンクや料理が遅いなんてこともなく楽しく飲めました。お料理は鶏料理が美味しくて特に鶏の生ハムは初めて食べたのですが気に入りました！ 釜飯ならおまかせ！ 美味しい釜飯が食べたくてうかがいました。17年連続特A受賞「山形県産はえぬき米」を使っているだけあってご飯はツヤツヤふっくらですごく美味しいです。また食べたいです。 いい雰囲気の大人な居酒屋さん 友達とちょっと寄り道で行きました混んでましたが、ゆったりしたつくりで工夫された空間なので、狭い感じはしませんでしたビールもおいしいモツ煮込み、モツもとろとろで、煮込み汁も濃厚モツとよく絡んで…つづきを読む 賑やかさが心地よいＢＧＭに 駅のすぐ近くにあるので迷ったらとりあえずここ！という感じですね。値段も手ごろだし、料理もドリンクも美味しいし＾＾個室はあるみたいですが、予約も無しに行けば普通のテーブル席に通されます。暖簾でテーブ…つづきを読む
池袋,神戸だしお好み焼・鉄板焼・食べ放題 花門亭 池袋店,https://www.hotpepper.jp/strJ000002959/,JR池袋駅,1,2500,70,あり,池袋/個室 名物だしお好み焼きの鉄板居酒屋,5,食べ放題利用 お好み焼き、もんじゃを選び、一つにつきトッピングが2種しか選べないのが残念でしたが、料理の提供は早く、生地自体ダシが効いていたのでトッピングが少なくても美味しくいたたけました。通常のメニューも美味し…つづきを読む 雰囲気が良い、お好み焼き屋さん お好み焼き屋さん独特の匂いや内装とは違い、雰囲気が良い店内でした。お好み焼きは焼いてくれるので食感が美味しくて、その中でも「とろ玉ふわふわお好み焼き」は、その名の通りフワフワしてて絶品でした。同僚…つづきを読む 美味しかった！！ 神戸風の、ダシに付けて食べるお好み焼きがあります。初めて食べたのですが、焼かれたお好み焼きを、ダシに浮かべると、ふわっとさっぱりいただけて、とても美味しかったです！もちろん、ソースで食べるお好み…つづきを読む お好み焼き旨い！呑める店ですね＾＾ お好み焼きが薄い焼き方で、パリッと表面がしていて、サクッとした食感で、中はとろっと柔らかくて美味しかったです。お好み焼以外にも、メニューが豊富で、ビールに焼酎と、お酒が進みました。ここは、また来…つづきを読む おいちー ビルの２階なので見つけるのに時間がかかるかもしれませんが、池袋東口からすぐです。東京では珍しい神戸のお好み焼き屋さんです。だしを付けて食べます。だしを付けて食べるのは初めてでしたけど、新しい発…つづきを読む
池袋,腹八分目 池袋北口店,https://www.hotpepper.jp/strJ000005989/,JR／都営丸の内線池袋駅,2,2200,90,あり,2013年『からあげグランプリ』最高金賞受賞,3,この価格で…☆ あの特大特盛りの唐揚げにスンドゥブチゲ、豆腐のサラダどれも女性2人でわけて食べて満足するボリュームと味でした☆デザートもお酒も美味しかった（≧∇≦）柚子はちみつマッコリはカルピスみたいでマッコ…つづきを読む 雰囲気と笑顔が素敵なお店 友人三人と初めて行くお店でした。池袋北口から徒歩二分という近さで、ファミリーマートの上にあるお店。看板もわかりやすく出ているので、迷わずにいけました。まず店内は落ち着きのある茶系の色でまとめ…つづきを読む メガから揚げ メガポテトならぬ、メガから揚げ。そのデカさは圧巻です。から揚げだけでなく、全体的に料理のボリュームが高い。そして、何より安い！いい意味で「腹八分目」という看板が似つかわしくない料理の数…つづきを読む
池袋,ブラッスリー・ル・リオン 池袋西武店,https://www.hotpepper.jp/strJ000980295/,◆JR池袋駅,-1,3500,60,なし,ママ会、女子会に使えるカジュアルフレンチ,3,とても居心地が良く、お食事も美味しかったです★ いつも子どもが一緒なので、お店の外から見るだけでしたが、お友達とランチという事で、予約して行きました。いつも混んでいるので、ホットペッパーで予約出来るなんて感動でした。ランチもコースにするか迷…つづきを読む ふらっと立ち寄りやすい 白を基調としたフランスのカフェを再現したようなお店だと思います。駅直結なので買い物の帰りとかにふらっと立ち寄りやすいのも魅力の一つです。プレーンオムレツがフワフワでコクがあり美味でした。 池袋で素敵なランチを。。。 久々の友達と池袋で会うので、休日ランチは混むので予約。昔、恵比寿の系列店にお邪魔しておいしかったし、クーポン使えば２０００円以下でランチコース食べられるし。急遽友達のベビーを連れていったけど、お店…つづきを読む
池袋,池袋 Meat Chops ミートチョップス,https://www.hotpepper.jp/strJ001041115/,JR池袋駅,5,3500,54,なし,肉メインの人気店!月、火曜日21時～狙い目!,9,スタッフさんのサービス申し分なし！ 友人の結婚祝いで、ウエディングサービスあったので決めました。店員さんの配慮がありがたく、気持ちのよい会になりました。メニューがたくさんあったので、少し迷うくらいでした！（もう少しメニューにどういう…つづきを読む はじめて行きました お通しはキャベツの千切りサラダ、食べ放題(笑)飲み放題に単品をいくつか、蝦夷しかのステーキ、枝豆のわさび漬け牛のwine煮、旨かった。肉祭りの店でした、店員さんは元気いいし POPな雰囲気 女子会で行きました！店内はPOPな雰囲気で賑やかな感じでした。照明がダウンライトだったので良かったです。料理は串盛りが、珍しかったので注文しました！お肉がメインなのでどれもボリューム満点でした…つづきを読む お洒落な居酒屋 店の外観とカウンターがとてもお洒落なお店です同僚の誕生日会で使用したのですが、サプライズケーキを用意して貰いました店員さんや周りのお客さんも盛り上げてくれてとても満足しました。年齢層は若いと思い…つづきを読む 串焼き 綺麗なお店です。串焼きの種類がとても多くて選ぶのが楽しく、メニューを選ぶだけでも盛り上がって楽しく過ごせました。店員さんも親切でこちらのわからないことに笑顔で答えてくれよかったです。旅行の時に行った…つづきを読む パーフェクト 職場の女子会でお邪魔しました。お店も活気があり、店員さんも感じよく串焼きを頼んだ時は『少し大きめですが大丈夫ですか？』などと声をかけて頂き親切でした。料理も全て味が良くバーニャカウダーの野菜も新鮮…つづきを読む ブクロネーゼ鍋 ウッド調のお洒落な雰囲気の店内で落ち着いて食事を楽しむことが出来ました。料理も肉料理がメインかと思っていたのですが、そんなに重た過ぎず美味しく頂きました。値段もリーズナブルで助かりました。店員さん…つづきを読む ミートチョップス お店の雰囲気が個性的でてゲームができる席まであって面白かったです。スキヤキ串やハンバーク串などなど他にはない串焼きがあって料理も味はもちろん楽しめました。ワインの種類が豊富にあってお肉料理と一緒に…つづきを読む 串焼きの種類が豊富で旨い！！ 清潔感溢れる小ざっぱりとした店内と、開放的な余裕のある作りがとても良かったです。串盛りがお得で旨いのでお勧めです。
池袋,プーアン池袋,https://www.hotpepper.jp/strJ001160884/,ＪＲ池袋駅,5,1500,20,なし,【サンシャイン通り沿い】タイ料理の名店,0,
池袋,【11/15 OPEN】炭火焼肉 牛道 池袋本店,https://www.hotpepper.jp/strJ001184837/,ゆったりボックスソファ席で本格炭火焼肉！池袋駅,3,1680,50,なし,池袋駅北口より徒歩3分♪食べ放題1980円～,0,
池袋,串家物語 ＬＡＢＩ１池袋店,https://www.hotpepper.jp/strJ000760558/,,1,3000,94,なし,◆熱々！揚げたて”串揚げ”食べ放題の店,17,子供達大喜び 日曜日の観劇後に総勢7名。子供達は自分達で揚げるのが楽しいのと、チョコレートファウンテンに大喜び。大人３人はビール飲み放題をつけましたが、ホールスタッフが少ない為なかなかオーダーを取りに来てくださ…つづきを読む 楽しい 結婚記念日にいつも行かないような店を予約しました。自分たちで揚げながら食べるのが楽しくて次は自宅から近い店舗にいこうか、と話していますデザートやサラダやカレーも食べ放題で大満足です 家族連れ向き 子どもが楽しんで、串揚げできるのでおすすめ・甘未もそろっているので、子供も満足でした。カレーややきそばなど、子供にうけるものがそろっています。サラダもありあっさり茶漬けも食べれます・高…つづきを読む 楽しい リーズナブルで、素材はなかなか新鮮です。お店の方も気さくで気前がよく、気持ちよく食事ができました。また行きたいです。 予約必須！！ いつも長蛇の列です！全てセルフなので、気兼ねなく自分の食べたいものを大量に食べられます！笑  サラダやデザート、ごはんものもあるので、飽きずに楽しめます。 手頃の値段 1500円で90分の値段は手ごろだと思います。肉の串は小さかったでした。。。。。。でも食べ放題ので、いっぱい取ったらいいと思います。ドリンクバー200円も安かったです。 色々楽しめます。 木の温かみのアットホームな店内なので、ゆったりとくつろげます。食べ放題で、串の他にもカレーやデザートなどもありますから色々楽しめます。 サイドメニューも充実してる串揚げ屋さん！！ 自分で揚げる串揚げ食べ放題 のお店で、皆でワイワイやりながら揚げて食べるのが楽しいですよ～～！！串揚げ以外のサイドメニューも豊富で美味しいので、お勧めのお店です！！ おいしい串揚げ 清潔感あってとてもきれいなお店です。できたてのサクサクの串揚げが食べ放題でとってもお気に入りのお店です。デザートもたくさんあり、女子も沢山います。店員さんの感じも良いのでおすすめのお店です。 盛りあがり間違いなし☆ 自分で具材を取ってきて、自分のテーブルで揚げるというのがとても新鮮で、それだけで楽しかったです！また、中にはたい焼きやスマイルポテトなど、少し変わったものも置いてあって、友達と行くと盛りあがると思いま…つづきを読む おいし楽し♪ 土曜の夕方6時過ぎに行きました。すでに人が椅子に座って待ってる状態。レジの店員さんに名前を告げて、待つこと1時間。やっとはいれました♪バイキング形式で、好きな食材を自分で持ってきて、自分で揚げる…つづきを読む 楽しい！ 串あげ以外の品数も多く、家族で来ても…好きなものを個々自由に選んで食べられるから良いですね～♪うちのように子供達が大きくなると、なかなか家族で外食する機会も少ないので、こういう店の方が盛り上がるな～…つづきを読む 種類豊富！！ いつも夜に来店していますが今日はランチにいってみましたランチだと６０分制ですが値段が安くてお得野菜にお肉に魚にゴハンはカレーやお茶漬けなどあり大満足☆デザートもあるしぜひまた行きたいです 好きなだけ串揚げ食べ放題♪ GW初日のランチに行きました。混んでいるかと思って早めに行ったら、意外と空いていてすんなり入れました。セルフで取りに行くのですが、サラダやデザートが置いてあるところが少し離れているため、途中まで…つづきを読む まさに楽しいバイキング！ 休日の昼間に行ったのですが､13時過ぎだったためかすぐに案内されました。各机ごとで揚げることができるため､油の匂いがつかないか心配してしまうかもですが、上着やカバンは椅子の下にすっぽり隠せるので、そ…つづきを読む たっ…楽しいっ ３０分程待ってやっと店内に。波がありますが、通路が狭く感じます。誰もが小さなお皿に串を大盛にしてテーブルに戻っていました(笑)。ご飯があったりうどんがあったり、他サラダや一品ものなど、もちろ…つづきを読む 楽しい♪ とにかく色々な食材があって楽しいです ご飯物も充実してます(^-^)スイーツもあるので甘いもの好きな女の子には大満足間違いなしですよ！
池袋,三間堂 池袋サンシャイン通り店,https://www.hotpepper.jp/strJ000954945/,［池袋駅,4,3000,78,あり,池袋東口 居酒屋 飲み会 昼宴会 地酒 3時間,4,小宴会 料理はそれぞれ美味しかったと思いますよ！獺祭が飲み放題にあったので予約したのですが満足でした。またリピートしたいと思います。 コストパフォーマンス高いですね！ 繁華街の居酒屋ビルの中にありますが、店舗内も広く心地よかったです。コース料理でなく3時間飲み放題で好きな食べ物をチョイスできたので満足度高いです。店員さんも割りとキビキビしていて感じが良かったです…つづきを読む 2016年02月同僚と利用しました！ ２月限定のおでん食べ放題コースを利用して、職場の同僚と利用しました。おでんは、半端じゃなく美味しかったです。そして、他のコース料理も上品で素晴らしい味付けでした。日本酒のメニューには種類が豊富に記…つづきを読む 夜景がきれい 料理は美味しく、リーズナブルで、とても良かったです。このお店を利用する際には、夜景の見える席がお勧めです。
池袋,ワインバル うきしま倉庫 池袋西口,https://www.hotpepper.jp/strJ000861676/,ＪＲ池袋駅,2,3000,40,なし,池袋西口のお洒落なワインバル☆女子会にも,2,食事が美味しかった！ 友人と忘年会で利用しました。お店の内装がとてもオシャレで、一緒に行った友人も喜んでいました。また、予約名で箸袋が作ってあり、これはとても嬉しいサプライズでした。飲み放題付きのコースを予約しまし…つづきを読む ワインの数の多さに脱帽しました 店内には相当な数のワインが並べられており、ワインの数の多さに脱帽しました。魚介ワイン蒸しの味付けが絶妙で身も厚みがあり美味しかったです。
池袋,３００Ｂ ONE 池袋西口本店,https://www.hotpepper.jp/strJ000000806/,JR池袋駅,3,3000,80,あり,◆こだわりのステーキと焼肉をご堪能あれ◆,23,"最高の2時間！！！ スタッフの対応、味、時間などなど全てよかったです！たまたま、出張で来ていてたまたまSNSで宣伝されてたので行ってみましたがとてもとても満足です！また、来たいと思います！ 良かったです。 入り口横のスペースでした。メニューは多くて選びきれないほど、お肉もデザートも美味しかったです！店員さんも声を掛けたらすぐ来てくれますし。またたくさん食べたくなったらリピートありかもと思います。 満腹の更にその先へ♪ ウワサのステーキ食べ放題３００Ｂ　ＯＮＥに行ってきました♪食べ放題なんで硬すぎるのとか脂身ばっかりとか思ってましたけどぜんぜんそんな肉は無く６人でガッツリ満足出来ました♪肉で満腹なんだ…つづきを読む 2015年12月頃夕食の時間帯に行きました ステーキ食べ飲み放題のコースを注文しました。ステーキが美味しいのもそうですが、チキンやポークは勿論、一人一切れ限定ではあるものの、鹿や羊など普段食べない肉も食べれるので飽きが来ません。デザートや、…つづきを読む 初めの「姫若牛」は鉄板。 ステーキ食べ放題コースを頼むとスタートの挨拶の様に「姫若牛」が出て来、「これを食い切ってから他をどんどん注文してください」というシステムになっている。その後「鹿」「子羊」「馬」「豚」と注文していくの…つづきを読む 美味い 安くてボリュームたっぷり。がっつり食べたい方にはおススメです。少し狭いですが。お腹いっぱいに食べました。 ガッツリと食べたい時に お肉をガッツリと食べたいときにおすすめのお店です。安価でとても大きいステーキが食べられるので、重宝しています。 ３００Ｂ ONE 食べ放題というお得なお店でしたがアラカルトも豊富でおすすめです。お酒も種類豊富だしお肉からデザートまで充実の品揃えなのが嬉しかったです。お料理は焼肉もありながら魚介系の日本酒に合うメニューもあり嬉…つづきを読む 感動しました。 若姫牛のギガステーキを注文しましたが、お肉は口に入れると一瞬にして肉汁が広がって行き、蕩けるような柔らかさで、旨味が合って豊かな味わいのソースとすごくマッチしていて感動しました。 女子会＆デートで利用 女子会で利用したのは昨年8月でした。暑い日に女子10人で、一人3,400円のコースを利用。確か料理9品＋3時間飲み放題。なんといっても魅力はステーキと飲み放題の種類の豊富さ。特にこのコースは琥珀…つづきを読む サイドメニューが豊富 お肉がメインのお店ですがそれ以外のメニューも豊富にあってお酒も色々と楽しめてとても満足でした。店内も賑わっていて幅広い年代のお客さんが入っていて人気の高さが伺えました。料理もおいしくお財布にも優し…つづきを読む ステーキ ステーキ、安くて美味しくて最高です。他には、この値段でここまで満足できるとこは、なかなかないです。また、ちかいうちに利用したいです。 大満足 食べ放題で大丈夫なのと心配になるくらいおいしいお肉でした｡種類も豊富で全然飽きなかったです｡女性にはなんといってもデザート!!手づくりだからおいしいし､シフォンケーキやシャーベットもあるので沢…つづきを読む ステーキが･･･ ステーキが3000円台で食べ放題なんて…あまり期待してなかったけど。。。厚みもありボリューム満点!!食べごたえありです！新鮮なので生で食べてもOKと言う若姫牛はとても柔らかくて美味しかったです！…つづきを読む 自家製の食べ放題 あちこちと食べ放題に行く私ですが、最近はどこでも同じような料理に出くわすことがあります。そう、ほとんどのお店では特にケーキ類はビュフェなどは出来合いが多いようですサラダなどを食べて…つづきを読む リーズナブルでボリュームたっぷり 300B-ONEコース…9品2H飲み放題付　を注文しました。居酒屋チェーン店みたいなありふれたコースメニューじゃなく、美味しいし、リーズナブルでボリュームがあるので、何度も通ってます♪…つづきを読む CPで選ぶなら・・・ 大学生相手の飲み屋さんです。お客さんも比較的若いですし。お店の雰囲気は１Fは不思議な空間。配管が出ているインテリアはオシャレかも。２Fは宴会用のテーブルがおいてありました。私は焼肉食べ放題と普通のコー…つづきを読む OIOIの裏にあるかなり安いお店。 私は池袋周辺でバイトをしている関係で、バイトの打ち上げの時期になると池袋の飲み屋を探すんですが、このお店は二度ほど使った記憶があります。価格としては、かなりリーズナブルな部類にはいると思われま…つづきを読む 食べ放題コース 食べ放題コースは種類も多く、珍しい鹿肉があったりして楽しめた。ノルマメニューの量がやや多かった。この時は8名で行ったが、もし、2～3名程度ならノルマだけで腹いっぱいになってしまうかもしれない。…つづきを読む みんなでワイワイ♪ お店の雰囲気ゎカジュアル＋レトロって感じです。２５００円くらいのコースで予約をしていました。お料理ゎ前菜から始まり、サラダ、牛肉のタタキ、白身魚のカルパッチョ、フライドポテ…つづきを読む もくもく、もりもり 先日友達の誘いで食べ放題コースで行きました店内に入ると焼き肉の香ばしい匂いが漂っていて席には昔子供の頃に見たことがある焼き肉台が置いてあります。ここの店は無煙ロースターでなく昔の焼き肉スタ…つづきを読む 食ったー！……いや、まだいける！ タイトルは店を出た時の気分なんで気にしないで下さい。。。(=～=;)実は、行きたかった別の食べ放題の店が予約で満杯だったんで急遽ココに来ました。金曜だから予約して行ったのですが、店内が…つづきを読む パーティー！パーティー！ 会社の人に連れられて初めて店内に踏み入った時は「おもしろーvv」ってカンジでした！雰囲気が普通の居酒屋とかファミレスとは全然違う！1階はアメリカの小さな酒場、ってカンジで配管？丸出…つづきを読む"
池袋,自遊空間 池袋北口店,https://www.hotpepper.jp/strJ001169360/,,2,1000,52,あり,池袋北口徒歩2分☆ネットカフェ♪シャワー,0,
池袋,腹八分目 池袋西口店,https://www.hotpepper.jp/strJ000025823/,池袋駅,1,2200,95,あり,2013年『からあげグランプリ』最高金賞受賞,1,伝説はさすが！ 久しぶりに逢う友人（女子）三人で。「久しぶりだし、ガッツリいきたい」とのテーマで、値段と居心地の良さを重視して検索しました。平日だったためか、店員さんが少なく、入るなり誰もでてきません。中まで…つづきを読む
