地区,店舗名,リンク,最寄り駅,距離,予算,席数,個室,キーワード,コメント数,コメント
赤坂,秘伝のにんにくダレ焼き鶏 塩つくね 博多水炊き てけてけ 赤坂見附店,https://www.hotpepper.jp/strJ001052313/,地下鉄銀座線 赤坂見附駅,1,2500,160,あり,赤坂 居酒屋 焼き鳥  個室 宴会,20,唐揚げのおいしさにやみつき 職場が赤坂見附にあったため、仕事終わりに会社の先輩後輩と良く利用していました。特にやみつき唐揚げは形も大きく、味が良く染み込んでいて、とても美味しかったので、何度も頼んでしまいました。次回、またお店を…つづきを読む お手頃価格 「てけてけ」の魅力は、なんといってもお財布に優しいところですね。お給料日前などは本当にありがたいです。お店の売りである焼き鳥は、お値段以上のおいしさです。こちらの赤坂見附のお店は男性客が多いですが、わ…つづきを読む 救世主 場所柄値段の高いお店もたくさんある地域ですがここは安心してたくさんお酒がいただけるのでとてもありがたい。特に生ビールは200円以下なので何倍飲んでも安心です。おつまみも定番の焼き鳥や絶品のつくね…つづきを読む つくねが美味しいよ！ 地下鉄銀座線・丸ノ内線の赤坂見附駅から徒歩1分の所にあり、仕事終わりによく食べに行ってます。ニンニクの醤油ダレで食べる「つくね」と、いつも〆に食べる「コラーゲンスープの鶏雑炊」は絶品ですよ。昼はランチ…つづきを読む 友人達と飲みに行きました。 先日、友人達と久しぶりに会ったので飲みに行きました。友人にススメられて行きました。お料理、ドリンクともにとても美味しかったです。お店の雰囲気はよかったです。平日のためかかなり空いていました。接客は素晴…つづきを読む とてもありがたい 活気ある店内楽しく、とてもお得にお酒が楽しめるお店です。とくに生ビールが１８０円なのがうれしくお財布を気にしなくて済むのがよい。鶏料理もおいしく、特につくねはジューシーでリーズナブルでとてもお気に…つづきを読む めちゃくちゃ安い こんな値段でいいのかと思うほど、全メニュー安くて驚きでした。３人で行って、満足に食べ、飲みましたが、ひとりあたり千円いきませんでした。安いけど、焼き鳥の味はかなり美味しかったです。ドリンクも他の…つづきを読む てけてけ 赤坂見附店 焼き鳥一本79円、生ビールが一杯180円ととてもリーズナブルな居酒屋さんです。焼き鳥は国産若鶏を使用しており、鮮度も抜群なので身がぷりぷりしていてとても美味しかったです。寒い時期にはてけてけ自慢の…つづきを読む ビールが安い。 駅から近いのでよりやすく飲むのに最適です。ビールが安いのでたくさん飲みたい時に利用することが多いです。串料理もリーズナブルで美味しくチーズ料理も種類があるので好きです。お店の雰囲気もそこまでガヤガ…つづきを読む 香ばしく焼き上げられた てけてけ赤坂見附店といえばにんにく醤油ダレで香ばしく焼き上げられたつくねや、旨味が凝縮されたもも鉄板焼き、コラーゲンたっぷりで旨味がぎっしりとつまった博多水炊きなどが看板メニューの居酒屋です。内装もし…つづきを読む 鶏肉がたくさん食べれます。 チェーン店で、よくお見かけする看板なのですが、行ったことがなく、友達と飲みに行ってきました。鶏肉料理がたくさんあり、串焼きから鶏そばまでとにかく鶏肉づくしで楽しめました。やみつき鶏唐揚げが、とにかくお…つづきを読む 仕事帰りに 友達と合流して安くて美味しい居酒屋に行こうということで、てけてけという居酒屋に行ってきました。ほんとに安くてポリュームあって美味しかったです。楽しくおしゃべりして、何品かは注文して飽きないくらいで…つづきを読む やっすーい！！ とにかく安くてびっくり！！！のお店です。ビールは、かなりお安く飲めます。安くても料理はしっかりしていて、美味しいです。熱々のままで出てくるのもポイントが高かったです。仲間うちで、気を使わない飲み会のと…つづきを読む 安くて美味しい 平日の夜に利用しました。職場の飲み会で利用したのですが、賑やかで居酒屋らしさがあり良い雰囲気でした。店員さんも愛想がよいです。焼き鳥や、他のおつまみも全て普通に美味しいです。値段の安さにはとても驚きま…つづきを読む コスパの良さがダントツ 友達と二人でいきましたが、店内はほぼ男性でにぎわっています。平日休日共ににぎやかなお店ですかね。有名な安価串焼きやさんなどがありますが、私はこちらの方が好きです！100円以下の串から揃えてあり…つづきを読む お手頃な値段でおいしい鶏肉を ０次会で同僚と利用しました。早い時間でしたが広い店内はすでに賑わっており、とても活気がありました。軽くつまむだけのつもりだったのですが、メニューにおいしそうなお料理が並んでいたのであれこれ頼んでしまい…つづきを読む 宴会利用に 地下のお店ですが、座席数も広く、宴会にはぴったりのお店でした。生が198円と、とてもリーズナブル！串ものが充実していて、今回は串の盛り合わせを頼みました。他のメニューも、価格が抑えられていて、と…つづきを読む 驚きの価格 場所がら高級なお店が立ち並ぶ赤坂でオアシスのようなリーズナブルでとても重宝するおみせです。料理やお酒、とくにビールの安さにびっくりしました。ビール党の私としては大助かりです。コスパ高いです。 安い 焼き鳥が食べたくて、近くのお店を調べて行きました。平日の夜でしたが、店内は仕事帰りのサラリーマンで賑わっていました。焼き鳥も飲み物も安くて良かったです。 鶏・鶏・鶏！ 鶏料理が自慢のお店とあって、メニューは鶏ばかり・・・にんにく醤油が自慢の焼き鳥、つくね、水炊きなど鶏好きにはたまらない、鶏づくしに浸れます。もっともっといろんなメニューが豊富にあってもいいかな、…つづきを読む
赤坂,一ツ木 竹林草,https://www.hotpepper.jp/strJ000119458/,赤坂見附駅,2,12000,25,なし,隠れ家割烹 日本食 和食,1,初すっぽん！ 「美味しいすっぽんを食べるならここ！」と連れて行ってもらいました。カウンター席でご主人の包丁さばきも楽しめます。生き血はワインで割ってあるので飲みやすいです。色さえ気にならなければ（笑）。…つづきを読む
赤坂,（赤坂 韓国料理）プロカンジャンケジャン,https://www.hotpepper.jp/strJ000796442/,赤坂駅,3,7000,62,あり,韓国発！本格カニ専門店が赤坂に上陸！,5,クセになるおいしさ！ 韓国で食べて以来ハマったカンジャンケジャン。本場韓国に比べるとお値段は割高ですが美味しさにはかないません。お行儀なんて気にせずかぶりついて吸い付いてます(^_^;)カニの甘み、タレとの相性は抜群…つづきを読む 本場韓国の味 有名人も足繁く通う韓国での有名店とのことで韓国好きの友人と訪問。初めてのカンジャンケジャンは甘辛で食べ出したらやめられない止まらない味でした！食べ進めていくと蟹味噌の濃厚な旨味が感じられて最高です。…つづきを読む もう一度食べたい、、 韓国旅行で食べたケジャンの味が忘れられず友人と2人でカニを食べに行きました。お店によってソースが違うようにも思いますがプロカンジャンケジャンさんのソースは日本人好みでとっても食べやすいですケジャ…つづきを読む 私は大好き！でも好みが…(;´д｀) 家族が遊びに来たので連れていきました。カンジャンケジャンは韓国で数回食べたことがあって大好きだったので自信をもって連れていきました。私は案の定美味しかった♪日本向けにしてあるのか生臭さも少なかったし…つづきを読む 絶品！カンジャンケジャン！！ テレビ番組で紹介されているのを見て、とっても美味しそうで、いてもたってもいられず、すぐに予約をして1人で行ってきました～。同じものが食べてみたかったんです！赤坂駅から少し歩いたところにあるので、…つづきを読む
赤坂,分店 なかむら食堂,https://www.hotpepper.jp/strJ000988133/,赤坂駅,8,5000,60,なし,季節の食材を楽しめる“みんなの食堂”,0,
赤坂,SMT Tokyo -エスエムティートウキョウ-,https://www.hotpepper.jp/strJ001171231/,東京メトロ千代田線赤坂駅,1,5000,110,なし,赤坂駅すぐ！モダンコリアンダイニング,0,
赤坂,大阪焼肉・ホルモン ふたご 赤坂店,https://www.hotpepper.jp/strJ001184898/,東京メトロ赤坂見附駅,3,5000,52,なし,厳選牛を量半分・値段半分でご提供！！,0,
赤坂,宴会 和食 居酒屋 語らい処「坐・和民」 赤坂見附駅前店,https://www.hotpepper.jp/strJ000119586/,赤坂見附駅,1,3000,190,あり,赤坂見附 居酒屋 飲み放題 3時間 宴会,1,打ち上げ 赤坂BLITZイベント後に友人と二人で予め予約して行ってきました。落ち着いた雰囲気(日曜だからかもしれませんが)で良かったです。特に店員の◯◯◯◯さんが可愛いので本当に最高でした。またゆっくり飲み…つづきを読む
赤坂,アフリカ料理 エコ ロロニョン（EKO lolonyon） 赤坂,https://www.hotpepper.jp/strJ001071925/,東京メトロ千代田線「赤坂駅,3,4000,35,なし,日本で唯一食べられる西アフリカトーゴ料理,0,
赤坂,完全個室居酒屋 江戸小町（えどこまち） 赤坂店,https://www.hotpepper.jp/strJ001127147/,◆個室のご予約はお早めに♪赤坂駅,3,3000,140,あり,飲み放題/完全個室/誕生日/記念日/女子会,5,満足ランチ 仕事仲間と行きました。お目当ては鶏ささみの天ぷらプレートなので迷わずお願いして暫し待ちです。店内は意外と広めでいい感じです。鶏ささみは天ぷらは揚げたてアツアツでいいお味です。甘辛いタレがか…つづきを読む 飲み放題が◎ 個室でゆっくりと頂く事が出来ます。仲間内で、周りを気にせず、飲食する事が出来て、良かったです。コース料理に飲み放題を付け、充分満足な会となりました。事前の問い合わせにも、丁寧に対応して下さり、安心して…つづきを読む 新鮮な魚介を使用 その日に仕入れた魚介のみを使っているという刺身が良かったです。新鮮で魚本来の旨味がありました。3点盛りと5点盛りがありましたが、5点盛りを注文しました。その他のメニューも種類が豊富で料理のバリエーショ…つづきを読む 送別会 送別会で利用しました。上司のオススメです。お料理、ドリンクともにとても美味しかったです。お店の雰囲気はよかったのですが週末だったせいかかなり賑やかでした。接客は素晴らしく店員さんが親切丁寧であ…つづきを読む 寒椿コース、3H飲放題！ 先輩のおすすめで行きました。寒椿コース7品　3H飲放題で3000円という安さです。お店もおしゃれで雰囲気も良く落ち着きます。ただ、金曜・土曜日・祝前日・繁忙期は2Hとなるようです。コースは3名から…つづきを読む
赤坂,レストラン大とし,https://www.hotpepper.jp/strJ001161874/,赤坂駅,5,0,15,あり,赤坂に佇むスタイリッシュな創作フレンチ,0,
赤坂,赤坂 本格中華 龍城,https://www.hotpepper.jp/strJ000989561/,■溜池山王駅,1,5000,106,あり,個室で楽しむ本格中華★大型宴会にも◎,2,2015年04月頃夕食の時間帯に行きました 会社の先輩の送迎会で利用しました。会社からも近く2時間食べ飲み放題で、4000以下とリーズナブル。しかも、料理の種類も多く、大皿でボリュームもあり、美味しかったです。又、伺いたいと思います。 ボリュームたっぷり 気軽に入れる中華料理のお店です。どの料理もボリュームがあるのでお腹一杯食べたい方にオススメです。特に春巻きや餃子が美味しかったです。
赤坂,薬膳火鍋専門店 天香回味 赤坂店,https://www.hotpepper.jp/strJ000010451/,地下鉄赤坂見附駅,4,5000,32,なし,薬膳鍋／点心料理,1,人気の薬膳火鍋をランチで 赤坂見附駅の近くにある薬膳火鍋専門店 天香回味に行ってきました。火鍋の超人気店です。夜に火鍋コースを食べて以来、味と効果にすっかりはまって、赤坂見附以外にも銀座・六本木のお店も良く行ってい…つづきを読む
赤坂,ニューカブト,https://www.hotpepper.jp/strJ001184419/,赤坂駅,3,2500,25,なし,赤坂駅徒歩３分アットホームなカラオケバー,0,
赤坂,鹿児島県霧島市 塚田農場 赤坂見附店,https://www.hotpepper.jp/strJ001124936/,地下鉄銀座線赤坂見附駅,1,3500,63,なし,自社養鶏場地鶏と鹿児島産食材の居酒屋,1,安くて美味しい居酒屋 会社帰りに同僚と利用。チェーン店では好きな店の一つです。何より塚田農場はご飯が美味しいのがその理由。コストパフォーマンスも料理の美味しさからするとかなり良いと思います。お通しのキャベツに付ける味噌…つづきを読む
赤坂,PCA （パブカーディナルアカサカ）,https://www.hotpepper.jp/strJ000712057/,地下鉄赤坂駅,4,6000,77,あり,赤坂/ダイニングバー/女子会/2次会/夜景,1,『東京・赤坂』という雰囲気そのままの、ラグジュアリー＆スタイリッシュな大人の空間です。 赤坂なら「つけ麺」って思ってた王子だったのですがシュンのお腹にもう入りそうにないことを予測し、Barみたいな、ちょっと飲みにしようと変更してくれました。楽しみにしてたのにごめんなさい。(T…つづきを読む
赤坂,本場韓国焼肉 兄夫食堂,https://www.hotpepper.jp/strJ000003091/,千代田線赤坂駅,2,3000,136,あり,赤坂 韓国料理・韓国本場焼肉・居酒屋,14,サインがたくさん 赤坂の韓国料理店がたくさんある一帯にあります。ビルの1階なのですがちょっと奥まったところにあります。入るのに少し勇気が要ります。いつもスンドウプセットを注文してます。ビビンバとスンドゥプとお…つづきを読む ごちそうさまでした(^_^) 友達とチーズダッカルビが食べたい！ということでこちらの赤坂 韓国料理 兄夫食堂にお邪魔しました。まず、ここのお店はすごい混んでいます。チーズダッカルビと飲み物を注文すると、すぐさまチーズダッカ…つづきを読む 思いがけない出会い 新しく始まった中華料理は本当においしかったです。韓国料理を食べに行って本当に意外に出会いに驚かざるをえませんでした。赤坂韓国料理で韓国式中()華料理をするが、24時間営業にデリバリまでするなんて驚…つづきを読む 美味しい赤坂の韓国料理屋 赤坂や新大久保には予算5000円以内の美味しい韓国料理が沢山あるけれど、兄夫食堂は他より美味しさが2割勝っています！古びた雰囲気がお洒落な店料理はサムギョプサル//厚切りの豚バラ肉を専用の鉄板(…つづきを読む 美味しかった 美味しかったです、まだ、忘年会シーズンでないのか、比較的余裕があり、良かった。韓国料理はなんでも、いけますね 2016年02月頃ランチの時間帯に行きました お店はビルの奥の方にあるので少し場所がわかりにくいかも。店に入ると韓流スターのサインがビッシリ！500円ランチから1000円程度でスタンダードなラインナップです。けっこう混んでいます。おいしかっ…つづきを読む 赤坂で見つけたのり巻きの美味しい店。 三連休なのに彼女とけんかして小腹がすいたので赤坂まで韓国料理食べに・・・なぜこのお店を選んだかというと24時間営業してるし、とある韓流スターが日本に来日した際に食事をしたお店だからです。夜中の…つづきを読む 初コッケタン 週末に予約なしで行ったので一時間半という時間制限はあったけどすぐに案内されました。予定どおり、コッケタンと海鮮チヂミを注文。コッケタンは半身にされた蟹がこれでもか！ていうくらい入っていて肉厚で食べ…つづきを読む 赤坂の御用達 兄夫食堂はお昼も夜も赤坂では御用達のお店です。ランチは12:00から限定で週替わりの500円ランチがあります。赤坂近辺では一番美味しいと思われる、大好物のスンドゥブのときや、サンゲタンの時は飛び…つづきを読む 韓国みたい 赤坂店に先日行ってきましたビルが丸ごと兄夫食堂だったような気がします。店内には韓流スターのサインと日本タレントのサインが多数かなり賑やかな雰囲気で韓国に旅行行った時のことを思い…つづきを読む ★★　ここは絶対ソウル！ 年中無休、２４時間営業。お店の壁一面には韓国タレントの親筆サインも飾っていて、僕にはわからないけど、韓流ファンには垂涎の的らしい。店内は、若者が主流、団体さんもガンガンいます。1Ｆ、2Ｆ、4Ｆと…つづきを読む 限定500円ランチ テレビ紹介を見て、翌日すぐにランチタイムに行きました。限定30食の500円ビビンバランチを注文。13:30をまわっていましたがこの日はまだありました。注文して、２分くらいで来ました！おいしい…つづきを読む パク・ヨンハさんのファンは是非来店しましょう！ ヨンハファンでしたら大抵の方が来店されていると思います。ヨンハくんのサインが飾ってありますし、ヨンハくんが何度も来店しているお店だからです。ヨンハくんが通うほどあって、味もとても美味しいです。…つづきを読む 辛いものが好きならオススメ！ 辛いものが好きな人なら絶対にオススメのお店です。昼には、いろいろな定職メニューがあるんですが、中でも一番のオススメは、なんと言っても「水豆腐チゲ」です。やわらかい豆腐と激辛のチゲスープのバランスが…つづきを読む
赤坂,オイスター＆ワイン PESCADERIA ペスカデリア,https://www.hotpepper.jp/strJ000660353/,東京メトロ千代田線赤坂駅,5,5000,50,なし,赤坂 赤坂見附 溜池山王 女子会 牡蠣 カキ,2,お料理もおいしいですが、サングリアがおいしいです！ ランチでよく利用していましたが、ディナーでも何回か利用してます。お料理もおいしいですが私は特にサングリアが大好きです。飲みすぎてしまうので、注意してください。お店は小さいので予約をお勧めし…つづきを読む パスタランチ ランチでよく行きます。牡蠣のカルボナーラ病みつきです。ドリンクの量がもう少しあれば最高です。夜も小皿料理なので、女同士でワインを飲みながら、オイスターを食べて、満足できるお店です。
赤坂,俺のフレンチ・イタリアン AKASAKA,https://www.hotpepper.jp/strJ001098302/,◆赤坂見附駅,5,4000,90,なし,赤坂/赤坂見附/俺の/イタリアン/フレンチ,6,評判通り 店内は賑やかで活気がありますが、場所柄か年齢層高か目で落ち着けます。接客は、常ににこやかで気が利いていました。料理は評判通り、とても美味しかったです。種類豊富な野菜で目も楽しめました。ちょっと変…つづきを読む 美味しい～♪ 女性3人で利用。あんなに溢れんばかりのなみなみスパークリングワインは初めて！そしてフォアグラ大根がめちゃめちゃ美味しかった♪今までの食べてたフォアグラってなんだったんだろうと思うほど、衝撃的でした…つづきを読む 予想以上に 父と母の結婚記念日だったので前から行きたいと思っていた俺のフレンチイタリアンを予約してみました。フレンチやイタリアンは高いイメージがあったのですが、安くて美味しかったし、シェアできるのが良かったです…つづきを読む ビーフテンダーロインロッシーニ風 これが食べたくて行きました！！お肉は赤みがあってすごく柔らかいし、フォアグラの外はカリッと中はトロっとしててもう最高！！超満足！！ 2015年01月頃夕食の時間帯に行きました たまたま店の前を通りかかったら、席が空いてるとのこと！行った事がなかったので、これはチャンスと思い入店。リーズナブルな価格ですが、とてもおいしく大満足でした。座席の間が狭く店員によくぶつかるのは仕方な…つづきを読む 予定が早く分かっていれば予約もできます 16時頃に入店しましたが、並ばずに入ることができました。１ヶ月前に予定が分かっていれば、予約する事も可能で、イスのある席を予約することができるようです。料理はどれもおいしく、そしてリーズナブルでし…つづきを読む
赤坂,ビーフラット,https://www.hotpepper.jp/strJ000864060/,赤坂駅,-1,6000,150,なし,赤坂のジャズライブの店,0,
赤坂,宵の口,https://www.hotpepper.jp/strJ000243114/,赤坂駅,4,7000,80,なし,赤坂の路地裏に佇む日本家屋で鳥料理,0,
赤坂,貝作,https://www.hotpepper.jp/strJ000119397/,千代田線赤坂駅,8,20000,40,なし,赤坂 接待 日本料理 河豚  法事 貝料理,1,貝好きにはたまりません！思い出に残る食事会に是非。 生花の活け込み、気さくで教養のある女将さんや仲居さんの行き届いた応接、植え込みの見える個室などなど、とてもリッチな雰囲気の中でのお食事は最高でした。貝刺身はそれは新鮮、アワビのステーキは歯ごたえ…つづきを読む
赤坂,チョンギワ 新館,https://www.hotpepper.jp/strJ000004008/,東京メトロ赤坂見附駅,3,7000,85,あり,【純 韓国家庭料理】◆赤坂駅から徒歩1分!,0,
赤坂,居酒屋 兄夫,https://www.hotpepper.jp/strJ001170711/,千代田線赤坂駅,2,3000,136,あり,赤坂駅から徒歩2分！本格韓国料理 居酒屋★,0,
赤坂,焼鳥屋 鳥貴族 赤坂一ツ木通り店,https://www.hotpepper.jp/strJ001177545/,東京メトロ銀座・丸ノ内線  赤坂見附駅,2,2980,102,なし,298円均一(税抜)の国産焼鳥の居酒屋！,0,
赤坂,SAMURAI DINING HYGEIA,https://www.hotpepper.jp/strJ001153587/,地下鉄【赤坂駅,1,3980,46,なし,NEW OPEN スタイリッシュなネオ大衆居酒屋,0,
赤坂,月の市場,https://www.hotpepper.jp/strJ000012080/,東京メトロ（丸ノ内線・銀座線）赤坂見附駅,2,4500,120,あり,赤坂見附徒歩２分★お庭の見えるイタリアン,1,カジュアルなイタリアン 会社帰りに同期とご飯へ。赤坂見附駅から歩いてすぐの場所なのでアクセスは最高に良いと思います。お店は洒落た地中海風のインテリアでデートにも使えそう。お料理はどれも美味しく、ボリュームもちょうど良かっ…つづきを読む
